{
  "$schema": "https://json-schema.org/draft/2020-12/schema",
  "$id": "https://schemas.cdsoft.com.cn/vastplan/deployment/v1/vastplan.desired-state.schema.json",
  "title": "VastPlan Local Desired State v1",
  "type": "object",
  "additionalProperties": false,
  "required": ["version", "revision", "metadata", "units"],
  "properties": {
    "version": { "const": 1 },
    "revision": { "type": "integer", "minimum": 1 },
    "metadata": {
      "type": "object",
      "additionalProperties": false,
      "required": ["name"],
      "properties": {
        "name": { "type": "string", "minLength": 1, "maxLength": 160 },
        "tenant": { "type": "string", "minLength": 1, "maxLength": 160 }
      }
    },
    "units": {
      "type": "array",
      "items": { "$ref": "#/$defs/serviceUnit" }
    }
  },
  "$defs": {
    "pluginRef": {
      "type": "object",
      "additionalProperties": false,
      "required": ["id", "version", "sha256"],
      "properties": {
        "id": { "$ref": "https://schemas.cdsoft.com.cn/vastplan/common/v1/identifiers.schema.json#/$defs/pluginId" },
        "version": { "$ref": "https://schemas.cdsoft.com.cn/vastplan/common/v1/identifiers.schema.json#/$defs/semver" },
        "channel": { "$ref": "https://schemas.cdsoft.com.cn/vastplan/common/v1/identifiers.schema.json#/$defs/channel", "default": "stable" },
        "sha256": { "type": "string", "pattern": "^[a-f0-9]{64}$" }
      }
    },
    "placement": {
      "type": "object",
      "additionalProperties": false,
      "properties": {
        "nodeSelector": {
          "type": "object",
          "additionalProperties": { "type": "string", "minLength": 1 }
        }
      }
    },
    "resourceList": {
      "type": "object",
      "additionalProperties": false,
      "properties": {
        "cpu_millis": { "type": "integer", "minimum": 0 },
        "memory_bytes": { "type": "integer", "minimum": 0 },
        "gpu": { "type": "integer", "minimum": 0 }
      }
    },
    "resources": {
      "type": "object",
      "additionalProperties": false,
      "properties": {
        "requests": { "$ref": "#/$defs/resourceList" }
      }
    },
    "serviceUnit": {
      "type": "object",
      "additionalProperties": false,
      "required": ["id", "kind", "plugins", "enabled", "service_role", "replicas"],
      "properties": {
        "id": { "type": "string", "pattern": "^[a-z0-9][a-z0-9._-]{0,127}$" },
        "kind": { "const": "service" },
        "plugins": {
          "type": "array",
          "minItems": 1,
          "items": { "$ref": "#/$defs/pluginRef" }
        },
        "config": { "type": "object" },
        "enabled": { "type": "boolean" },
        "service_role": { "enum": ["backend", "workspace", "rs"] },
        "logical_service": { "type": "string", "minLength": 1, "maxLength": 160 },
        "instance_policy": { "enum": ["per-kernel", "active-active", "leader", "partitioned"] },
        "state_model": { "enum": ["local-ephemeral", "external-shared", "leader-owned", "partition-owned"] },
        "visibility": { "enum": ["local", "service", "cluster", "global"] },
        "routing": { "enum": ["direct", "queue", "leader", "shard"] },
        "routing_domain": { "type": "string", "minLength": 1, "maxLength": 160 },
        "startup_tier": { "enum": ["bootstrap", "full"] },
        "depends_on": { "type": "array", "uniqueItems": true, "items": { "type": "string", "minLength": 1, "maxLength": 160 } },
        "replicas": { "const": 1 },
        "resources": { "$ref": "#/$defs/resources" },
        "placement": { "$ref": "#/$defs/placement" }
      }
    }
  }
}
